{
  "ip": "8.8.8.8",
  "isp": "Google LLC",
  "location": {
    "country": "US",
    "region": "California",
    "city": "Mountain View",
    "lat": 37.40599,
    "lng": -122.078514,
    "postalCode": "94043",
    "timezone": "-07:00",
    "geonameId": 5375480
  },
  "as": {
    "asn": 15169,
    "name": "GOOGLE",
    "route": "8.8.8.0/24",
    "domain": "https://about.google/",
    "type": "Content"
  },
  "domains": [
    "dns.google",
    "8.8.8.8.in-addr.arpa"
  ]
}
